{
  "hero": {
    "variant": "image-full",
    "eyebrow": "Melbourne's Plastering Specialists",
    "title": "Reliable Plastering\nThat Lasts",
    "intro": "Family owned and operated with over 60 years combined experience. From small patches to full renovations — quality workmanship, fair pricing, and we don't leave until you're satisfied.",
    "primaryLabel": "Fast Free Quote",
    "primaryUrl": "/contact/",
    "secondaryLabel": "Our Services",
    "secondaryUrl": "/services/",
    "imageUrl": "/uploads/hero-plastering.jpg"
  },
  "servicesVariant": "icon-grid",
  "testimonialsVariant": "grid",
  "galleryVariant": "portfolio",
  "ctaVariant": "band"
}
